{
    "$schema": "../article.schema.json",
    "id": "example-article",
    "title": "Sample Article Title",
    "content": [
        {
            "type": "section",
            "heading": {
                "type": "heading",
                "level": 1,
                "content": {
                    "type": "string",
                    "content": "Introduction"
                }
            },
            "content": [
                {
                    "type": "paragraph",
                    "content": {
                        "type": "string",
                        "content": "This is the introduction paragraph of the article."
                    }
                },
                {
                    "type": "quote",
                    "content": {
                        "type": "string",
                        "content": "This is a quote."
                    }
                }
            ]
        },
        {
            "type": "section",
            "heading": {
                "type": "heading",
                "level": 2,
                "content": {
                    "type": "string",
                    "content": "Main Content"
                }
            },
            "content": [
                {
                    "type": "paragraph",
                    "content": {
                        "type": "string",
                        "content": "Here is some main content with a code example."
                    }
                },
                {
                    "type": "code",
                    "size": "block",
                    "syntax": "javascript",
                    "content": {
                        "type": "string",
                        "content": "console.log('Hello, World!');"
                    }
                }
            ]
        }
    ],
    "metadata": {
        "authors": [
            {
                "id": "author-1",
                "name": "John Doe"
            }
        ],
        "createdOn": "2023-10-01",
        "tags": [
            "sample",
            "article",
            "json-schema"
        ]
    }
}